{
  "create_styles": [
    {
      "styleId": "CSI_SectionID__ARCH",
      "name": "CSI Section ID (Architect Template)",
      "type": "paragraph",
      "derive_from_paragraph_index": 0,
      "basedOn": null
    },
    {
      "styleId": "CSI_SectionName__ARCH",
      "name": "CSI Section Name (Architect Template)",
      "type": "paragraph",
      "derive_from_paragraph_index": 1,
      "basedOn": null
    }
  ],
  "apply_pStyle": [
    { "paragraph_index": 0, "styleId": "CSI_SectionID__ARCH" },
    { "paragraph_index": 1, "styleId": "CSI_SectionName__ARCH" }
  ],
  "roles": {
    "SectionID": { "styleId": "CSI_SectionID__ARCH", "exemplar_paragraph_index": 0 },
    "SectionTitle": { "styleId": "CSI_SectionName__ARCH", "exemplar_paragraph_index": 1 },
    "PART": { "styleId": "SectionTitle", "exemplar_paragraph_index": 2 },
    "ARTICLE": { "styleId": "Article", "exemplar_paragraph_index": 3 },
    "PARAGRAPH": { "styleId": "SpecParagraph", "exemplar_paragraph_index": 4 },
    "SUBPARAGRAPH": { "styleId": "SubParagraph", "exemplar_paragraph_index": 5 },
    "SUBSUBPARAGRAPH": { "styleId": "SubSubParagraph", "exemplar_paragraph_index": 65 }
  },
  "notes": [
    "Paragraphs 0 (SECTION 23 31 13) and 1 (METAL DUCTS) have no pStyle - creating CSI_SectionID__ARCH and CSI_SectionName__ARCH derived from these exemplars.",
    "PART headings (paragraphs 2, 61, 141) already use existing 'SectionTitle' style - reusing as-is for PART role.",
    "All other CSI hierarchy levels already have well-defined styles: Article, SpecParagraph, SubParagraph, SubSubParagraph.",
    "No changes needed to paragraphs beyond 0 and 1 since existing styles are consistently applied throughout the document.",
    "Paragraph 194 (END OF SECTION) uses 'EndSection' style and is not part of CSI hierarchy - left unchanged."
  ]
}